{
  "videoSlug": "why-the-roman-empire-really-collapsed",
  "fps": 30,
  "resolution": "1920x1080",
  "scenes": [
    {
      "sceneNumber": 1,
      "narration": "September, 476 AD. The Roman Empire falls. And almost nobody notices.",
      "usedFacts": [
        "F021",
        "F023"
      ],
      "wordCount": 11,
      "estimatedDuration": 4.4,
      "template": "text-emphasis",
      "props": {
        "text": "476 AD: NOBODY NOTICED",
        "emphasisWords": [
          "NOBODY NOTICED"
        ],
        "animation": "impact"
      },
      "assets": {
        "fromLibrary": [],
        "newAssets": []
      },
      "emotionalTone": "Mysterious, subversive.",
      "startTime": 0.0,
      "endTime": 4.4,
      "duration": 4.4
    },
    {
      "sceneNumber": 2,
      "narration": "No burning city. No final battle. Just a boy emperor, quietly told to go home.",
      "usedFacts": [
        "F021"
      ],
      "wordCount": 15,
      "estimatedDuration": 6.0,
      "template": "text-emphasis",
      "props": {
        "text": "NO BATTLE. NO FIRE.",
        "emphasisWords": [
          "NO"
        ],
        "animation": "fade-scale"
      },
      "assets": {
        "fromLibrary": [],
        "newAssets": []
      },
      "emotionalTone": "Quiet, eerie.",
      "startTime": 4.4,
      "endTime": 10.4,
      "duration": 6.0
    },
    {
      "sceneNumber": 3,
      "narration": "Because the empire didn't die that day. It had been dying for three hundred years.",
      "usedFacts": [
        "F001"
      ],
      "wordCount": 15,
      "estimatedDuration": 6.0,
      "template": "timeline-scene",
      "props": {
        "title": "A 300-Year Collapse",
        "events": [
          {
            "label": "The rot sets in",
            "date": "235 CE"
          },
          {
            "label": "The \"fall\" of Rome",
            "date": "476 CE"
          }
        ],
        "highlightIndex": 1
      },
      "assets": {
        "fromLibrary": [],
        "newAssets": []
      },
      "emotionalTone": "Ominous, intriguing.",
      "startTime": 10.4,
      "endTime": 16.4,
      "duration": 6.0
    },
    {
      "sceneNumber": 4,
      "narration": "This is the real story of how Rome collapsed, and why everyone remembers it wrong.",
      "usedFacts": [
        "F001"
      ],
      "wordCount": 15,
      "estimatedDuration": 6.0,
      "template": "transition-break",
      "props": {
        "title": "THE REAL STORY",
        "subtitle": "Why the Roman Empire Really Collapsed",
        "chapterNumber": 1,
        "style": "zoom"
      },
      "assets": {
        "fromLibrary": [],
        "newAssets": []
      },
      "emotionalTone": "Confident, contrarian.",
      "startTime": 16.4,
      "endTime": 22.4,
      "duration": 6.0
    },
    {
      "sceneNumber": 5,
      "narration": "Picture the empire everyone imagines: endless legions, marble cities, roads that ruled the world.",
      "usedFacts": [],
      "wordCount": 14,
      "estimatedDuration": 5.6,
      "template": "map-scene",
      "props": {
        "region": "roman-empire-max-extent",
        "camera": "slow-zoom-out",
        "mapAsset": "map-roman-empire",
        "highlights": [
          "borders"
        ],
        "onScreenText": "THE ETERNAL EMPIRE"
      },
      "assets": {
        "fromLibrary": [],
        "newAssets": [
          {
            "id": "map-roman-empire",
            "description": "Clean vector map of the Roman Empire with layers for provinces, east/west split, and Mediterranean coastlines",
            "suggestedSource": "Wikimedia Commons (CC0/PD vector search)"
          }
        ]
      },
      "emotionalTone": "Grand, admiring.",
      "startTime": 22.4,
      "endTime": 28.0,
      "duration": 5.6
    },
    {
      "sceneNumber": 6,
      "narration": "But an empire isn't marble. It's a machine: an army, paid by taxes, paid in silver.",
      "usedFacts": [
        "F010"
      ],
      "wordCount": 16,
      "estimatedDuration": 6.4,
      "template": "list-reveal",
      "props": {
        "title": "The Machine",
        "items": [
          "An army",
          "Paid by taxes",
          "Collected in silver"
        ],
        "numbered": false
      },
      "assets": {
        "fromLibrary": [],
        "newAssets": []
      },
      "emotionalTone": "Analytical, clear.",
      "startTime": 28.0,
      "endTime": 34.4,
      "duration": 6.4
    },
    {
      "sceneNumber": 7,
      "narration": "That army numbered somewhere between four hundred thousand and six hundred thousand men.",
      "usedFacts": [
        "F009"
      ],
      "wordCount": 13,
      "estimatedDuration": 5.2,
      "template": "stat-card",
      "props": {
        "value": "400,000–600,000",
        "label": "soldiers in the late Roman army",
        "secondaryText": "modern estimates of its total size",
        "icon": "icon-soldier",
        "countUp": false
      },
      "assets": {
        "fromLibrary": [],
        "newAssets": [
          {
            "id": "icon-soldier",
            "description": "Minimal flat soldier/legionary icon for grids and stat cards",
            "suggestedSource": "CC0 icon set (e.g. SVG Repo, Wikimedia Commons)"
          }
        ]
      },
      "emotionalTone": "Impressive, weighty.",
      "startTime": 34.4,
      "endTime": 39.6,
      "duration": 5.2
    },
    {
      "sceneNumber": 8,
      "narration": "Soldiers expected pay and supplies, every single year. Multiply that by half a million men.",
      "usedFacts": [
        "F009",
        "F010"
      ],
      "wordCount": 15,
      "estimatedDuration": 6.0,
      "template": "icon-grid",
      "props": {
        "icon": "icon-soldier",
        "count": 50,
        "label": "1 icon = 10,000 soldiers",
        "columns": 10
      },
      "assets": {
        "fromLibrary": [],
        "newAssets": [
          {
            "id": "icon-soldier",
            "description": "Minimal flat soldier/legionary icon for grids and stat cards",
            "suggestedSource": "CC0 icon set (e.g. SVG Repo, Wikimedia Commons)"
          }
        ]
      },
      "emotionalTone": "Mounting pressure.",
      "startTime": 39.6,
      "endTime": 45.6,
      "duration": 6.0
    },
    {
      "sceneNumber": 9,
      "narration": "It was the single biggest expense the Roman state had. And the bill kept growing.",
      "usedFacts": [
        "F010"
      ],
      "wordCount": 15,
      "estimatedDuration": 6.0,
      "template": "text-emphasis",
      "props": {
        "text": "ONE EXPENSE ABOVE ALL",
        "emphasisWords": [
          "ABOVE ALL"
        ],
        "animation": "impact"
      },
      "assets": {
        "fromLibrary": [],
        "newAssets": []
      },
      "emotionalTone": "Foreboding.",
      "startTime": 45.6,
      "endTime": 51.6,
      "duration": 6.0
    },
    {
      "sceneNumber": 10,
      "narration": "Break the machine that pays that army, and you break Rome. So let's break it.",
      "usedFacts": [],
      "wordCount": 15,
      "estimatedDuration": 6.0,
      "template": "transition-break",
      "props": {
        "title": "BREAK THE MACHINE",
        "chapterNumber": 2,
        "style": "wipe"
      },
      "assets": {
        "fromLibrary": [],
        "newAssets": []
      },
      "emotionalTone": "Dark anticipation.",
      "startTime": 51.6,
      "endTime": 57.6,
      "duration": 6.0
    },
    {
      "sceneNumber": 11,
      "narration": "Start in the year 235. Over the next fifty years, Rome burned through at least twenty-six emperors.",
      "usedFacts": [
        "F003"
      ],
      "wordCount": 17,
      "estimatedDuration": 6.8,
      "template": "stat-card",
      "props": {
        "value": 26,
        "label": "emperors in fifty years",
        "secondaryText": "235–284 CE",
        "countUp": true
      },
      "assets": {
        "fromLibrary": [],
        "newAssets": []
      },
      "emotionalTone": "Chaotic, breathless.",
      "startTime": 57.6,
      "endTime": 64.4,
      "duration": 6.8
    },
    {
      "sceneNumber": 12,
      "narration": "Twenty-six men in fifty years. The throne had stopped being a prize. It was a death sentence.",
      "usedFacts": [
        "F003"
      ],
      "wordCount": 17,
      "estimatedDuration": 6.8,
      "template": "silhouette-scene",
      "props": {
        "figures": [
          {
            "asset": "figure-emperor",
            "action": "fall",
            "position": "center"
          }
        ],
        "onScreenText": "A DEATH SENTENCE"
      },
      "assets": {
        "fromLibrary": [],
        "newAssets": [
          {
            "id": "figure-emperor",
            "description": "Robed, laurel-crowned emperor silhouette (works at adult or child scale)",
            "suggestedSource": "CC0 silhouette pack / self-drawn vector"
          }
        ]
      },
      "emotionalTone": "Grim.",
      "startTime": 64.4,
      "endTime": 71.2,
      "duration": 6.8
    },
    {
      "sceneNumber": 13,
      "narration": "Every general with an army could crown himself. So every general did. Civil war became routine.",
      "usedFacts": [
        "F002"
      ],
      "wordCount": 16,
      "estimatedDuration": 6.4,
      "template": "map-scene",
      "props": {
        "region": "roman-empire-max-extent",
        "camera": "drift",
        "mapAsset": "map-roman-empire",
        "highlights": [
          "interior-conflict"
        ],
        "onScreenText": "CIVIL WAR ON REPEAT"
      },
      "assets": {
        "fromLibrary": [],
        "newAssets": [
          {
            "id": "map-roman-empire",
            "description": "Clean vector map of the Roman Empire with layers for provinces, east/west split, and Mediterranean coastlines",
            "suggestedSource": "Wikimedia Commons (CC0/PD vector search)"
          }
        ]
      },
      "emotionalTone": "Cynical, chaotic.",